{
  "detectorId": "cache-underuse",
  "algorithmVersion": "0.1.0",
  "confidence": {
    "score": 0.82,
    "basis": "cacheRead was zero across all sampled calls despite repeated context"
  },
  "evidence": [
    {
      "kind": "sessions-without-cache-read",
      "count": 3,
      "sessionRefs": ["a1b2c3d4e5f60718a1b2c3d4e5f60718", "0f1e2d3c4b5a69780f1e2d3c4b5a6978"]
    },
    {
      "kind": "affected-resources",
      "refs": ["deadbeefcafe0011deadbeefcafe0011"]
    }
  ],
  "impactUSD": 4.21
}
